{
  "schemaVersion": 1,
  "id": "kokoro-text-to-speech",
  "revision": 1,
  "reviewedAt": "2026-07-19T00:00:00Z",
  "reviewer": "seed-critique (runner-evidenced, revision 1)",
  "frontend": true,
  "rubric": [
    {
      "dimension": "real-inference",
      "score": 5,
      "severity": "info",
      "evidence": "conformance (webgpu, headless no-GPU): 2✓ 0✗ 0▨ 0◍ — loads-clean=pass, calls-real-inference=pass. screenshots: reports/responsive/screens/kokoro-text-to-speech/desktop.png, reports/responsive/screens/kokoro-text-to-speech/mobile.png",
      "notes": ""
    },
    {
      "dimension": "io-shape",
      "score": 4,
      "severity": "info",
      "evidence": "conformance (webgpu, headless no-GPU): 0✓ 0✗ 0▨ 1◍ — io-shape-semantic=manual. screenshots: reports/responsive/screens/kokoro-text-to-speech/desktop.png, reports/responsive/screens/kokoro-text-to-speech/mobile.png",
      "notes": "auto-checkable parts pass; manual-evidenced parts need an agent to Read the screenshot and confirm real output / controls / parity."
    },
    {
      "dimension": "runtime-config",
      "score": 5,
      "severity": "info",
      "evidence": "conformance (webgpu, headless no-GPU): 5✓ 0✗ 0▨ 0◍ — declares-model-id=pass, declares-task=pass, declares-backend=pass, declares-quantisation=pass, inference-off-main-thread=pass. screenshots: reports/responsive/screens/kokoro-text-to-speech/desktop.png, reports/responsive/screens/kokoro-text-to-speech/mobile.png",
      "notes": ""
    },
    {
      "dimension": "cache-init",
      "score": 4,
      "severity": "info",
      "evidence": "conformance (webgpu, headless no-GPU): 1✓ 0✗ 0▨ 1◍ — shared-auto-init-loader=pass, auto-init-on-cached=manual. screenshots: reports/responsive/screens/kokoro-text-to-speech/desktop.png, reports/responsive/screens/kokoro-text-to-speech/mobile.png",
      "notes": "auto-checkable parts pass; manual-evidenced parts need an agent to Read the screenshot and confirm real output / controls / parity."
    },
    {
      "dimension": "states",
      "score": 4,
      "severity": "info",
      "evidence": "conformance (webgpu, headless no-GPU): 3✓ 0✗ 0▨ 1◍ — live-status-region=pass, errors-on-the-page=pass, honest-progress-retry-offline=manual, webgpu-capability-honest=pass. screenshots: reports/responsive/screens/kokoro-text-to-speech/desktop.png, reports/responsive/screens/kokoro-text-to-speech/mobile.png",
      "notes": "auto-checkable parts pass; manual-evidenced parts need an agent to Read the screenshot and confirm real output / controls / parity."
    },
    {
      "dimension": "controls",
      "score": 4,
      "severity": "info",
      "evidence": "conformance (webgpu, headless no-GPU): 0✓ 0✗ 0▨ 1◍ — controls-operable=manual. screenshots: reports/responsive/screens/kokoro-text-to-speech/desktop.png, reports/responsive/screens/kokoro-text-to-speech/mobile.png",
      "notes": "auto-checkable parts pass; manual-evidenced parts need an agent to Read the screenshot and confirm real output / controls / parity."
    },
    {
      "dimension": "no-fake-output",
      "score": 4,
      "severity": "info",
      "evidence": "conformance (webgpu, headless no-GPU): 0✓ 0✗ 0▨ 1◍ — no-fake-output=manual. screenshots: reports/responsive/screens/kokoro-text-to-speech/desktop.png, reports/responsive/screens/kokoro-text-to-speech/mobile.png",
      "notes": "auto-checkable parts pass; manual-evidenced parts need an agent to Read the screenshot and confirm real output / controls / parity."
    },
    {
      "dimension": "accessibility",
      "score": 5,
      "severity": "info",
      "evidence": "conformance (webgpu, headless no-GPU): 2✓ 0✗ 0▨ 0◍ — images-have-alt=pass, buttons-have-names=pass. screenshots: reports/responsive/screens/kokoro-text-to-speech/desktop.png, reports/responsive/screens/kokoro-text-to-speech/mobile.png",
      "notes": ""
    },
    {
      "dimension": "responsive",
      "score": 4,
      "severity": "info",
      "evidence": "conformance (webgpu, headless no-GPU): 2✓ 0✗ 0▨ 1◍ — responsive-desktop=pass, responsive-mobile=pass, parity-both-classes=manual. screenshots: reports/responsive/screens/kokoro-text-to-speech/desktop.png, reports/responsive/screens/kokoro-text-to-speech/mobile.png",
      "notes": "auto-checkable parts pass; manual-evidenced parts need an agent to Read the screenshot and confirm real output / controls / parity."
    },
    {
      "dimension": "performance",
      "score": 4,
      "severity": "info",
      "evidence": "conformance (webgpu, headless no-GPU): 0✓ 0✗ 0▨ 1◍ — inp-stays-low=manual. screenshots: reports/responsive/screens/kokoro-text-to-speech/desktop.png, reports/responsive/screens/kokoro-text-to-speech/mobile.png",
      "notes": "auto-checkable parts pass; manual-evidenced parts need an agent to Read the screenshot and confirm real output / controls / parity."
    }
  ],
  "guidanceConsulted": [
    {
      "id": "break-up-long-tasks",
      "recommendation": "Break up long main-thread tasks / yield so inference doesn't spike INP.",
      "appliedOrException": "applied — inference runs off the main thread via a Web Worker (or MediaPipe delegate); control UI stays responsive.",
      "evidence": "conformance inference-off-main-thread / mediapipe-gpu-delegate = pass"
    },
    {
      "id": "cross-document-transitions",
      "recommendation": "Use cross-document view transitions for catalogue↔page navigation.",
      "appliedOrException": "applied — @view-transition navigation:auto in public/styles.css (invariant 6).",
      "evidence": "shared design system; catalogue↔model nav"
    },
    {
      "query": "responsive control panel without horizontal overflow",
      "recommendation": "Fluid layout; avoid fixed widths that overflow narrow viewports.",
      "appliedOrException": "verify — responsive-desktop/mobile conformance assertions checked (see rubric).",
      "evidence": "responsive matrix run; reports/responsive/screens/kokoro-text-to-speech/"
    }
  ],
  "openQuestions": [
    "Does kokoro-text-to-speech produce semantically correct text-to-speech output on a real device (manual-evidenced)?",
    "Are all controls keyboard-operable with visible focus on both classes?"
  ],
  "followUpGoals": [
    {
      "goal": "Agent matrix pass for kokoro-text-to-speech: Read the mobile+desktop screenshots, confirm real output + tap targets + focus + dialogs, then flip support to ok (or unsupported+evidence) and enrich this critique.",
      "kind": "targeted-fix",
      "priority": "medium"
    }
  ],
  "summary": "Revision-1 seed for kokoro-text-to-speech (text-to-speech, webgpu) derived from the real conformance run + responsive screenshots. Auto-checkable assertions are recorded with their true pass/fail/blocked state; manual-evidenced dimensions await an agent verdict. Not a final review."
}
