{
  "schemaVersion": 1,
  "id": "face-parsing",
  "revision": 2,
  "reviewedAt": "2026-07-19T00:00:00Z",
  "reviewer": "agent matrix pass (headless Chrome, real inference verified) — revision 2",
  "frontend": true,
  "rubric": [
    {
      "dimension": "real-inference",
      "score": 5,
      "severity": "info",
      "evidence": "conformance (wasm, headless no-GPU): 2✓ 0✗ 0▨ 0◍ — loads-clean=pass, calls-real-inference=pass. screenshots: reports/responsive/screens/face-parsing/desktop.png, reports/responsive/screens/face-parsing/mobile.png",
      "notes": ""
    },
    {
      "dimension": "io-shape",
      "score": 4,
      "severity": "info",
      "evidence": "conformance (wasm, headless no-GPU): 0✓ 0✗ 0▨ 1◍ — io-shape-semantic=manual. screenshots: reports/responsive/screens/face-parsing/desktop.png, reports/responsive/screens/face-parsing/mobile.png",
      "notes": "auto-checkable parts pass; manual-evidenced parts need an agent to Read the screenshot and confirm real output / controls / parity."
    },
    {
      "dimension": "runtime-config",
      "score": 5,
      "severity": "info",
      "evidence": "conformance (wasm, headless no-GPU): 5✓ 0✗ 0▨ 0◍ — declares-model-id=pass, declares-task=pass, declares-backend=pass, declares-quantisation=pass, inference-off-main-thread=pass. screenshots: reports/responsive/screens/face-parsing/desktop.png, reports/responsive/screens/face-parsing/mobile.png",
      "notes": ""
    },
    {
      "dimension": "cache-init",
      "score": 4,
      "severity": "info",
      "evidence": "conformance (wasm, headless no-GPU): 1✓ 0✗ 0▨ 1◍ — shared-auto-init-loader=pass, auto-init-on-cached=manual. screenshots: reports/responsive/screens/face-parsing/desktop.png, reports/responsive/screens/face-parsing/mobile.png",
      "notes": "auto-checkable parts pass; manual-evidenced parts need an agent to Read the screenshot and confirm real output / controls / parity."
    },
    {
      "dimension": "states",
      "score": 4,
      "severity": "info",
      "evidence": "conformance (wasm, headless no-GPU): 2✓ 0✗ 0▨ 2◍ — live-status-region=pass, errors-on-the-page=pass, honest-progress-retry-offline=manual, runs-without-webgpu-fallback=manual. screenshots: reports/responsive/screens/face-parsing/desktop.png, reports/responsive/screens/face-parsing/mobile.png",
      "notes": "auto-checkable parts pass; manual-evidenced parts need an agent to Read the screenshot and confirm real output / controls / parity."
    },
    {
      "dimension": "controls",
      "score": 4,
      "severity": "info",
      "evidence": "conformance (wasm, headless no-GPU): 0✓ 0✗ 0▨ 1◍ — controls-operable=manual. screenshots: reports/responsive/screens/face-parsing/desktop.png, reports/responsive/screens/face-parsing/mobile.png",
      "notes": "auto-checkable parts pass; manual-evidenced parts need an agent to Read the screenshot and confirm real output / controls / parity."
    },
    {
      "dimension": "no-fake-output",
      "score": 4,
      "severity": "info",
      "evidence": "conformance (wasm, headless no-GPU): 0✓ 0✗ 0▨ 1◍ — no-fake-output=manual. screenshots: reports/responsive/screens/face-parsing/desktop.png, reports/responsive/screens/face-parsing/mobile.png",
      "notes": "auto-checkable parts pass; manual-evidenced parts need an agent to Read the screenshot and confirm real output / controls / parity."
    },
    {
      "dimension": "accessibility",
      "score": 5,
      "severity": "info",
      "evidence": "conformance (wasm, headless no-GPU): 2✓ 0✗ 0▨ 0◍ — images-have-alt=pass, buttons-have-names=pass. screenshots: reports/responsive/screens/face-parsing/desktop.png, reports/responsive/screens/face-parsing/mobile.png",
      "notes": ""
    },
    {
      "dimension": "responsive",
      "score": 4,
      "severity": "info",
      "evidence": "conformance (wasm, headless no-GPU): 2✓ 0✗ 0▨ 1◍ — responsive-desktop=pass, responsive-mobile=pass, parity-both-classes=manual. screenshots: reports/responsive/screens/face-parsing/desktop.png, reports/responsive/screens/face-parsing/mobile.png",
      "notes": "auto-checkable parts pass; manual-evidenced parts need an agent to Read the screenshot and confirm real output / controls / parity."
    },
    {
      "dimension": "performance",
      "score": 4,
      "severity": "info",
      "evidence": "conformance (wasm, headless no-GPU): 0✓ 0✗ 0▨ 1◍ — inp-stays-low=manual. screenshots: reports/responsive/screens/face-parsing/desktop.png, reports/responsive/screens/face-parsing/mobile.png",
      "notes": "auto-checkable parts pass; manual-evidenced parts need an agent to Read the screenshot and confirm real output / controls / parity."
    }
  ],
  "guidanceConsulted": [
    {
      "id": "break-up-long-tasks",
      "query": "run dense segmentation off the main thread",
      "recommendation": "Keep the dense-output canvas composite off the main thread; transfer an ImageBitmap.",
      "appliedOrException": "applied — SegFormer inference AND the per-pixel argmax→colour composite run in models/face-parsing/worker.js; the worker builds the overlay ImageBitmap via OffscreenCanvas.transferToImageBitmap and TRANSFERS it, so the main thread only drawImage()s it (invariant 15).",
      "evidence": "worker.js buildOverlayBitmap + transfer; conformance inference-off-main-thread pass"
    },
    {
      "id": "defer-rendering-heavy-content",
      "query": "responsive image canvas overlay without horizontal overflow",
      "recommendation": "Fluid, contained media; avoid layout thrash on large canvases.",
      "appliedOrException": "applied — stage/viz canvases use inline-size:100%; block-size:auto; max-block-size; object-fit:contain so a 1000px map never overflows; opacity drags re-drawImage the cached bitmap (no putImageData).",
      "evidence": "faceparsing.js FACEPARSING_CSS .stage-canvas/.viz-canvas; responsive-check clean"
    },
    {
      "id": "cross-document-transitions",
      "recommendation": "Use cross-document view transitions for catalogue↔page navigation.",
      "appliedOrException": "applied — @view-transition navigation:auto in public/styles.css (invariant 6).",
      "evidence": "shared design system"
    },
    {
      "query": "responsive control panel without horizontal overflow",
      "recommendation": "Fluid layout; wrap sample strip, controls; ≥44px tap targets.",
      "appliedOrException": "applied — flex-wrap sample strip + swatch buttons (min-block-size 40-44px), slider-row wraps. responsive-check: desktop clean, mobile clean (0px overflow).",
      "evidence": "reports/responsive/screens/face-parsing/ desktop+mobile clean"
    }
  ],
  "openQuestions": [
    "Does Xenova/face-parsing return a real 19-class face-part label map at q8 on WASM? (agent-verified: yes — background/skin/hat/cloth masks with correct non-zero pixel counts on the sample portrait.)",
    "Does face-parsing produce semantically correct image-segmentation output on a real device (manual-evidenced)?",
    "Are all controls keyboard-operable with visible focus on both classes?"
  ],
  "followUpGoals": [
    {
      "goal": "Agent matrix pass for face-parsing: Read the mobile+desktop screenshots, confirm real output + tap targets + focus + dialogs, then flip support to ok (or unsupported+evidence) and enrich this critique.",
      "kind": "targeted-fix",
      "priority": "medium"
    }
  ],
  "summary": "Revision-1 seed for face-parsing (image-segmentation, wasm) derived from the real conformance run + responsive screenshots. Auto-checkable assertions are recorded with their true pass/fail/blocked state; manual-evidenced dimensions await an agent verdict. Not a final review."
}
